"","ttext","date","isretweet","retweetcount","favoritecount","score","product","state","country","duplicate"
"1","RT @rajsan2017: I am for Modi in 2019 lot of unfinished job the entire lutiyeni darbar needs to destabilized.

 India is not just Lutiyens","2018-07-28 20:08:29","TRUE","3","0","-1","Employment","Karnataka","India",FALSE
"2","RT @rajsan2017: I am for Modi in 2019 lot of unfinished job the entire lutiyeni darbar needs to destabilized.

 India is not just Lutiyens","2018-07-28 20:07:21","TRUE","3","0","-1","Employment","Karnataka","India",TRUE
"3","RT @rajsan2017: I am for Modi in 2019 lot of unfinished job the entire lutiyeni darbar needs to destabilized.

 India is not just Lutiyens","2018-07-28 19:33:10","TRUE","3","0","-1","Employment","Karnataka","India",TRUE
"4","Trainee Engineer in Bangalore, Karnataka, India: piping, solar, civil, autocad, steel, engineer, iti  ","2018-07-28 19:22:07","FALSE","0","0","0","Employment","Karnataka","India",FALSE
"5","I am for Modi in 2019 lot of unfinished job the entire lutiyeni darbar needs to destabilized.

 India is not just L  ","2018-07-28 19:13:28","FALSE","3","5","-1","Employment","Karnataka","India",FALSE
"6","@INCIndia @CMofKarnataka @INCKarnataka @DrParameshwara @DKShivakumar Good job and good see our state top in renewab  ","2018-07-28 19:07:10","FALSE","0","0","3","Employment","Karnataka","India",FALSE
"7","This job might be a great fit for you: Big Data Engineer -  ","2018-07-28 17:46:53","FALSE","0","0","1","Employment","Karnataka","India",FALSE
"8","RT @profamishra: This is for all the graduates, postgraduates, CAs, Lawyers and other professionals who vote for BJP.... Good job guys....","2018-07-28 17:44:00","TRUE","6","0","1","Employment","Karnataka","India",FALSE
"9","@DSiddananja Adding fuel to the fire , I think the current CM should walk and talk like a pan Karnataka leader and  ","2018-07-28 17:36:25","FALSE","0","1","0","Employment","Karnataka","India",FALSE
"10","RT @profamishra: This is for all the graduates, postgraduates, CAs, Lawyers and other professionals who vote for BJP.... Good job guys....","2018-07-28 17:08:59","TRUE","6","0","1","Employment","Karnataka","India",TRUE
"11","Interested in a job in Bengaluru, Karnataka? This could be a great fit:  ","2018-07-28 17:08:08","FALSE","0","0","1","Employment","Karnataka","India",FALSE
"12","ENDLESS ARREST OF IPS POLICE OFFICIALS OF KARNATAKA!  CORRUPT ""UPSC"" BACKS CORRUPT OFFICIALS. -  ","2018-07-28 17:05:05","FALSE","0","0","-2","Employment","Karnataka","India",FALSE
"13","RT @profamishra: This is for all the graduates, postgraduates, CAs, Lawyers and other professionals who vote for BJP.... Good job guys....","2018-07-28 16:49:40","TRUE","6","0","1","Employment","Karnataka","India",TRUE
"14","HDKumaraswamy please help karnataka students for R R B banks exam for karnataka students because andra people entr  ","2018-07-28 15:55:48","FALSE","0","0","0","Employment","Karnataka","India",FALSE
"15","RT @profamishra: This is for all the graduates, postgraduates, CAs, Lawyers and other professionals who vote for BJP.... Good job guys....","2018-07-28 14:58:42","TRUE","6","0","1","Employment","Karnataka","India",TRUE
"16","RT @profamishra: This is for all the graduates, postgraduates, CAs, Lawyers and other professionals who vote for BJP.... Good job guys....","2018-07-28 14:52:26","TRUE","6","0","1","Employment","Karnataka","India",TRUE
"17","Domestic BPO Inbound Flipkart process in Bangalore, Karnataka, India: bpo  ","2018-07-28 14:41:45","FALSE","0","1","0","Employment","Karnataka","India",FALSE
"18","RT @profamishra: This is for all the graduates, postgraduates, CAs, Lawyers and other professionals who vote for BJP.... Good job guys....","2018-07-28 14:39:18","TRUE","6","0","1","Employment","Karnataka","India",TRUE
"19","This is for all the graduates, postgraduates, CAs, Lawyers and other professionals who vote for BJP.... Good job gu  ","2018-07-28 14:39:01","FALSE","6","17","1","Employment","Karnataka","India",FALSE
"20","Hiring for Flipkart Domestic BPO Voice in Bangalore, Karnataka, India: bpo  ","2018-07-28 14:31:44","FALSE","0","0","0","Employment","Karnataka","India",FALSE
"21","Domestic BPO for SBI Banking process in Bangalore, Karnataka, India: bpo  ","2018-07-28 14:21:43","FALSE","0","0","0","Employment","Karnataka","India",FALSE
"22","Customer Support Executive for Hindi and English in Bangalore, Karnataka, India: bpo  ","2018-07-28 14:11:43","FALSE","0","0","1","Employment","Karnataka","India",FALSE
"23","@ShobhaBJP Dear Madam try to change the rule in banking sector jobs, kannadiga's should get job in our Karnataka ba  ","2018-07-28 14:09:41","FALSE","0","0","0","Employment","Karnataka","India",FALSE
"24","customer support executive for E commerce BPO in Bangalore, Karnataka, India: bpo  ","2018-07-28 13:51:41","FALSE","0","0","1","Employment","Karnataka","India",FALSE
"25","Hiring for BPO Banking Process for Domestic BPO in Bangalore, Karnataka, India: bpo  ","2018-07-28 13:41:40","FALSE","0","0","0","Employment","Karnataka","India",FALSE
"26","for Reliance Jio Process in Bangalore, Karnataka, India: bpo  ","2018-07-28 13:21:39","FALSE","0","0","0","Employment","Karnataka","India",FALSE
"27","This job might be a great fit for you: Senior Client Care Executive - Personal Clients (Cards) -  ","2018-07-28 12:56:02","FALSE","0","0","1","Employment","Karnataka","India",FALSE
"28","Flipkart BPO is hiring for Customer Support Executive in Bangalore, Karnataka, India: bpo  ","2018-07-28 12:51:37","FALSE","0","0","1","Employment","Karnataka","India",FALSE
"29","Technical Support Executive for Acer Process in Bangalore, Karnataka, India: chat, os, officer, voice  ","2018-07-28 12:21:34","FALSE","0","1","1","Employment","Karnataka","India",FALSE
"30","[Job] Quality Assurance Environment Mangement | Company: Morgan Stanley | Location: Bengaluru KA Karnataka India |  ","2018-07-28 11:52:45","FALSE","0","0","1","Employment","Karnataka","India",FALSE
"31","Can you recommend anyone for this job in Bengaluru, Karnataka?  ","2018-07-28 11:19:15","FALSE","0","0","1","Employment","Karnataka","India",FALSE
"32","[Job] Maintenance Incharge | Company: cauvery hospital | Location: Mysore KA Karnataka India | Mysore Building  ","2018-07-28 11:03:09","FALSE","0","0","0","Employment","Karnataka","India",FALSE
"33","[Job] Technical Product Owner | Company: General Electric | Location: Bengaluru KA Karnataka India | Bengaluru  ","2018-07-28 11:02:52","FALSE","0","0","0","Employment","Karnataka","India",FALSE
"34","[Job] Assistant Manager - Engineering | Company: Marriott International, Inc | Location: Bengaluru KA Karnataka Ind  ","2018-07-28 11:02:50","FALSE","0","0","0","Employment","Karnataka","India",FALSE
"35","See our latest Bengaluru, Karnataka job and click to apply: Client Care Executive - Personal Clients (Cards) -  ","2018-07-28 10:40:29","FALSE","0","0","0","Employment","Karnataka","India",FALSE
"36","This job might be a great fit for you: Senior Client Care Executive - Personal Clients (Cards) -  ","2018-07-28 10:01:45","FALSE","0","0","1","Employment","Karnataka","India",TRUE
"37","We're hiring! Click to apply: Client Care Executive - Personal Clients (Cards) -  ","2018-07-28 09:22:58","FALSE","0","0","0","Employment","Karnataka","India",FALSE
"38","@AmitShah Sir
*R We So Weak That Any One Can Lynch Us In WB Karnataka Or Kerala?
* R We So Weak That Every Day Some  ","2018-07-28 08:43:30","FALSE","0","0","-2","Employment","Karnataka","India",FALSE
"39","Associate/Associate Consultant- SAM Simple Managed Services: Software One - Gurgaon, Haryana - Bangalore, Karnataka  ","2018-07-28 06:47:08","FALSE","0","0","0","Employment","Karnataka","India",FALSE
"40","Principal Consultant: Oracle - Bangalore, Karnataka - An experienced consulting professional who has an understandi  ","2018-07-28 06:47:08","FALSE","0","0","0","Employment","Karnataka","India",FALSE
"41","Associate/Associate Consultant (SAM Technical- Flexera): Software One - Gurgaon, Haryana - Bangalore, Karnataka - P  ","2018-07-28 06:47:07","FALSE","0","0","0","Employment","Karnataka","India",FALSE
"42","iOS Developer: Bangalore, Karnataka - We are looking for as iOS developer to join one of our teams. In this role, y  ","2018-07-28 06:47:07","FALSE","0","0","0","Employment","Karnataka","India",FALSE
"43","Graphic Design Internship in Bangalore at Ice and Soda Brands: Ice and Soda Brands - Bangalore, Karnataka - With ou  ","2018-07-28 06:47:07","FALSE","0","0","0","Employment","Karnataka","India",FALSE
"44","Legal Executive Legal CRM: Hinduja Global Solutions Limited (HGS) - Bangalore, Karnataka - Hi, We have an opening f  ","2018-07-28 06:47:06","FALSE","0","0","-1","Employment","Karnataka","India",FALSE
"45","Senior Engineer (Java Application) | Aeronube Technology | Bangalore: Aeronube Technology - Bangalore, Karnataka -  ","2018-07-28 06:47:06","FALSE","0","0","0","Employment","Karnataka","India",FALSE
"46","HR Data Analyst: Cargill - Bangalore, Karnataka - Principal Accountabilities 40% - Perform Data Analysis Pulling th  ","2018-07-28 06:47:05","FALSE","0","0","0","Employment","Karnataka","India",FALSE
"47","C WPF - 3 - 6 years - Bangalore: Capgemini - Bangalore, Karnataka - Job Specification: Sr. Developer (Tools Develo  ","2018-07-28 06:47:05","FALSE","0","0","0","Employment","Karnataka","India",FALSE
"48","C WPF - 3 - 6 years - Bangalore: Capgemini - Bangalore, Karnataka - Job Specification: Sr. Developer (Tools Develo  ","2018-07-28 06:30:06","FALSE","0","0","0","Employment","Karnataka","India",TRUE
"49","Media R&amp;D Developer: Ericsson - Bangalore, Karnataka - Job Summary: We are now looking for a Developer to maintain  ","2018-07-28 06:30:05","FALSE","0","0","0","Employment","Karnataka","India",FALSE
"50","We're hiring! Click to apply: Senior Client Care Executive - Personal Clients (Cards) -  ","2018-07-28 06:09:14","FALSE","0","0","0","Employment","Karnataka","India",FALSE
"51","See our latest Bengaluru, Karnataka job and click to apply: Client Care Executive - Personal Clients (Cards) -  ","2018-07-28 04:51:54","FALSE","0","0","0","Employment","Karnataka","India",TRUE
"52","many people in karnataka say that locals consider the people from andhra pradesh who come here and work in IT job a  ","2018-07-28 03:41:23","FALSE","0","0","1","Employment","Karnataka","India",FALSE
"53","Can you recommend anyone for this job? Client Care Executive - Personal Clients (Cards) -  ","2018-07-28 01:38:06","FALSE","0","0","1","Employment","Karnataka","India",FALSE
"54","Want to work in Bengaluru, Karnataka? View our latest opening:  ","2018-07-28 01:18:43","FALSE","0","0","1","Employment","Karnataka","India",FALSE
"55","See our latest Bengaluru, Karnataka job and click to apply: Officer/Analyst (Technology &amp; Operations / Banking Op  ","2018-07-27 23:41:53","FALSE","0","0","0","Employment","Karnataka","India",FALSE
"56","Want to work in Bengaluru, Karnataka? View our latest opening:  ","2018-07-27 22:24:21","FALSE","0","1","1","Employment","Karnataka","India",TRUE
"57","[Job] Software Engineer 1 (PowerMax) | Company: DELL | Location: Bengaluru KA Karnataka India | Bengaluru Genetic  ","2018-07-27 22:22:52","FALSE","0","0","0","Employment","Karnataka","India",FALSE
"58","[Job] Software Engineer 1 | Company: DELL | Location: Bengaluru KA Karnataka India | Bengaluru Genetic  ","2018-07-27 22:22:50","FALSE","0","0","0","Employment","Karnataka","India",FALSE
"59","[Job] Product Owner | Company: DELL | Location: Bengaluru KA Karnataka India | Bengaluru Genetic Engineering  ","2018-07-27 22:22:47","FALSE","0","0","0","Employment","Karnataka","India",FALSE
"60","[Job] Intern | Company: SonicWall | Location: Bengaluru KA Karnataka India | Bengaluru Genetic Engineering Jobs  ","2018-07-27 22:22:45","FALSE","0","0","0","Employment","Karnataka","India",FALSE
"61","We're hiring! Read about our latest job opening here: Project Manager -  ","2018-07-27 22:04:59","FALSE","0","0","0","Employment","Karnataka","India",FALSE
"62","We're hiring! Click to apply: Client Care Executive - Personal Clients (Cards) -  ","2018-07-27 21:26:15","FALSE","0","0","0","Employment","Karnataka","India",TRUE
"63","Software Engineer, Managed Data Service - (, Karnataka, India)  ","2018-07-27 21:00:56","FALSE","0","0","0","Employment","Karnataka","India",FALSE
"64","Systems Engineer - (, Karnataka, India)  ","2018-07-27 21:00:55","FALSE","0","0","0","Employment","Karnataka","India",FALSE
"65","We're hiring! Read about our latest job opening here: Developer -  ","2018-07-27 18:31:09","FALSE","0","0","0","Employment","Karnataka","India",FALSE
"66","@CMofKarnataka Change the banking sector selection process, in our Karnataka kannadiga should get the job, save our  ","2018-07-27 18:18:45","FALSE","0","0","0","Employment","Karnataka","India",FALSE
"67","RT @Sivajiisgod2000: T.N LA CAUVERY WATER- MR AIYAKANNU  CONG'O MEMBER'ADVOCATE'- JDS 'FORMERLY CONG'O  @hd_kumaraswamy GOVT  IN KARNATAKA-","2018-07-27 17:29:47","TRUE","1","0","0","Employment","Karnataka","India",FALSE
"68","T.N LA CAUVERY WATER- MR AIYAKANNU  CONG'O MEMBER'ADVOCATE'- JDS 'FORMERLY CONG'O  @hd_kumaraswamy GOVT  IN KARNATA  ","2018-07-27 17:19:20","FALSE","1","1","0","Employment","Karnataka","India",FALSE
"69","ARREST AFTER ARREST OF IPS POLICE OFFICIALS OF KARNATAKA!  CORRUPT ""UPSC"" BACKS CORRUPT OFFICIALS. -  ","2018-07-27 17:05:07","FALSE","0","0","-2","Employment","Karnataka","India",FALSE
"70","RT @anirudhganu: @ShatruganSinha He's out there doing a fine job for the country, not like NakliJaneudhari @RahulGandhi who goes on myster","2018-07-27 15:56:52","TRUE","1","0","2","Employment","Karnataka","India",FALSE
"71","We're hiring! Click to apply: Officer/Analyst (Technology &amp; Operations / MWS Operations / Private Bank Operations  ","2018-07-27 14:18:54","FALSE","0","0","0","Employment","Karnataka","India",FALSE
"72","City Operations Manager job at Multi Recruit - Bengaluru, Karnataka  ","2018-07-27 14:18:20","FALSE","0","0","0","Employment","Karnataka","India",FALSE
"73","This job might be a great fit for you: Senior Officer -  ","2018-07-27 13:40:01","FALSE","0","0","1","Employment","Karnataka","India",FALSE
"74","IBDP Maths Teacher-International School-Hyderabad in Bangalore, Karnataka, India: teacher, teachers  ","2018-07-27 13:08:58","FALSE","0","0","0","Employment","Karnataka","India",FALSE
"75","Want to work in Bengaluru, Karnataka? View our latest opening:  ","2018-07-27 13:01:17","FALSE","0","0","1","Employment","Karnataka","India",TRUE
"76","IBDP englsih Teachers-International IB School-Bangalore and Hyderabad in Bangalore, Karnataka, India:   ","2018-07-27 12:58:57","FALSE","0","0","0","Employment","Karnataka","India",FALSE
"77","IBDP Economics Teacher-International School-Hyderabad and Bangalore in Bangalore, Karnataka, India:   ","2018-07-27 12:48:56","FALSE","0","0","0","Employment","Karnataka","India",FALSE
"78","IBDP History Teacher-International IB School-Bangalore in Bangalore, Karnataka, India: teacher  ","2018-07-27 12:38:55","FALSE","0","0","0","Employment","Karnataka","India",FALSE
"79","IBDP ICT Teacher-International IB School-Pune in Bangalore, Karnataka, India: teacher, administrator  ","2018-07-27 12:28:54","FALSE","0","0","0","Employment","Karnataka","India",FALSE
"80","IBDP Biology &amp; ESS Teacher _ International school -bangalore in Bangalore, Karnataka, India: biology  ","2018-07-27 12:18:54","FALSE","0","0","0","Employment","Karnataka","India",FALSE
"81","@VinayVLi @dp_satish @SomBajju What immature comments ? He has done better than north Karnataka cm's. Announcing 42  ","2018-07-27 11:23:17","FALSE","0","0","0","Employment","Karnataka","India",FALSE
"82","Join the Standard Chartered Bank team! See our latest job opening here:  ","2018-07-27 11:04:54","FALSE","0","0","0","Employment","Karnataka","India",FALSE
"83","RT @rsprasad: India BPO Promotion Scheme is an initiative of DigitalIndia which has opened new job opportunities for the youth in small to","2018-07-27 11:03:18","TRUE","215","0","0","Employment","Karnataka","India",FALSE
"84","Want to work in Bengaluru, Karnataka? View our latest opening:  ","2018-07-27 10:26:08","FALSE","0","0","1","Employment","Karnataka","India",TRUE
"85","sales executives in Bengaluru, Karnataka, India: bd, sales, executives  ","2018-07-27 09:28:40","FALSE","0","0","0","Employment","Karnataka","India",FALSE
"86","@Ravikum13790677 @commonkannadiga @AnilApr24 @SNGowda4492 @hoysala_ Those north Karnataka politicians didnt develo  ","2018-07-27 09:21:56","FALSE","0","1","0","Employment","Karnataka","India",FALSE
"87","Assistant Marketing manager for 1-3 work experience in real estate in Bengaluru, Karnataka, India: seo  ","2018-07-27 09:08:39","FALSE","0","1","1","Employment","Karnataka","India",FALSE
"88","See our latest Bengaluru, Karnataka job and click to apply: Mgr,Group Regulatory Reporting -  ","2018-07-27 08:49:11","FALSE","0","0","0","Employment","Karnataka","India",FALSE
"89","Marketing executives in Bengaluru, Karnataka, India: estate, info, fluent, marketing, real estate  ","2018-07-27 08:28:36","FALSE","0","0","1","Employment","Karnataka","India",FALSE
"90","Want to work at Standard Chartered Bank? We're hiring in Bengaluru, Karnataka! Click for details:  ","2018-07-27 08:10:25","FALSE","0","0","1","Employment","Karnataka","India",FALSE
"91","RT @rsprasad: India BPO Promotion Scheme is an initiative of DigitalIndia which has opened new job opportunities for the youth in small to","2018-07-27 08:01:55","TRUE","215","0","0","Employment","Karnataka","India",TRUE
"92","Customer support executives in Bengaluru, Karnataka, India: admin, info, 2nd  ","2018-07-27 07:58:33","FALSE","0","0","1","Employment","Karnataka","India",FALSE
"93","[Job] SW Engineer - Industrial IOT | Company: Cisco | Location: Bengaluru KA Karnataka India | Bengaluru  ","2018-07-27 07:12:47","FALSE","0","0","0","Employment","Karnataka","India",FALSE
"94","[Job] R&amp;D Engineer | Company: ABB | Location: Bengaluru KA Karnataka India | Bengaluru Industrial Engineering  ","2018-07-27 07:12:45","FALSE","0","0","0","Employment","Karnataka","India",FALSE
"95","[Job] Staff Operations Analyst | Company: Cypress Semiconductor | Location: Bengaluru KA Karnataka India |  ","2018-07-27 07:02:51","FALSE","0","0","0","Employment","Karnataka","India",FALSE
"96","[Job] Senior Operations Research | Company: Sabre | Location: Bengaluru KA Karnataka India | Bengaluru Operations  ","2018-07-27 07:02:49","FALSE","0","0","0","Employment","Karnataka","India",FALSE
"97","[Job] Operations Research Engineer | Company: Intel | Location: Bengaluru KA Karnataka India | Bengaluru  ","2018-07-27 07:02:47","FALSE","0","0","0","Employment","Karnataka","India",FALSE
"98","[Job] Ad Dev Operations Analyst 1 | Company: Epsilon India | Location: Bengaluru KA Karnataka India | Bengaluru  ","2018-07-27 07:02:45","FALSE","0","0","0","Employment","Karnataka","India",FALSE
"99","RT @rsprasad: India BPO Promotion Scheme is an initiative of DigitalIndia which has opened new job opportunities for the youth in small to","2018-07-27 07:01:00","TRUE","215","0","0","Employment","Karnataka","India",TRUE
"100","RT @rsprasad: India BPO Promotion Scheme is an initiative of DigitalIndia which has opened new job opportunities for the youth in small to","2018-07-27 06:57:25","TRUE","215","0","0","Employment","Karnataka","India",TRUE
"101","Marketing &amp; Sales Catalyst - Advertising/MR/Branding/Account Planner Role (1-3 yrs): Bangalore, Karnataka - Marketi  ","2018-07-27 06:12:06","FALSE","0","0","0","Employment","Karnataka","India",FALSE
"102","Sales Manager || Banca || Surat , Bangalore || General Insurance: Mount Talent Consulting - Surat, Gujarat - Bangal  ","2018-07-27 06:12:04","FALSE","0","0","1","Employment","Karnataka","India",FALSE
"103","Contract Management Specialist- ""SAP Digital Interconnect"" Job: SAP - Bangalore, Karnataka - COMPANY DESCRIPTION As  ","2018-07-27 06:12:03","FALSE","0","0","-2","Employment","Karnataka","India",FALSE
"104","[Job] Environmental Engineer--- | Company: Auga Tech | Location: Bengaluru KA Karnataka India | Bengaluru  ","2018-07-27 05:12:45","FALSE","0","0","0","Employment","Karnataka","India",FALSE
"105","@RealHistoryPic What do u know.. Someone has been doing this job already by ordering a hit on intellectuals of Karnataka!","2018-07-27 05:11:39","FALSE","0","0","0","Employment","Karnataka","India",FALSE
"106","GSSInfosoftPvtLtd is looking for a Server Management (Windows) - 4 Yrs - IBM India, apply now! (Karnataka) job  ","2018-07-27 04:42:20","FALSE","0","0","0","Employment","Karnataka","India",FALSE
"107","[Job] Research Associate | Company: Hindustan Petroleum Corporation Limited | Location: Bengaluru KA Karnataka Indi  ","2018-07-27 03:32:47","FALSE","0","0","-1","Employment","Karnataka","India",FALSE
"108","[Job] Operations and maintenance-Engineer | Company: Avi Solar Energy Pvt Ltd | Location: Bengaluru KA Karnataka In  ","2018-07-27 03:32:45","FALSE","0","0","0","Employment","Karnataka","India",FALSE
"109","RT @onlytruthtb:       . We have to file PIL in SC, asking for dismantling of all Karnata","2018-07-27 03:29:46","TRUE","1","0","0","Employment","Karnataka","India",FALSE
"110","@Vijaykarnataka Sir plz solve the job problem. In our state most of the employees are other state people. Plz give  ","2018-07-27 03:15:06","FALSE","0","0","-1","Employment","Karnataka","India",FALSE
"111","RT @Anandagundurao: @DKShivakumar @RahulGandhi @INCKarnataka @INCIndia @IYC @NSUIKarnataka @IYCKar BJP and central leaders did such a smear","2018-07-27 02:57:54","TRUE","2","0","-1","Employment","Karnataka","India",FALSE
"112","      . We have to file PIL in SC, asking for dismantling of all  ","2018-07-27 01:08:16","FALSE","1","0","0","Employment","Karnataka","India",FALSE
"113","Want to work at Standard Chartered Bank? We're hiring in Bengaluru, Karnataka! Click for details:  ","2018-07-27 01:04:05","FALSE","0","0","1","Employment","Karnataka","India",TRUE
"114","If you're looking for work in Bengaluru, Karnataka, check out this job:  ","2018-07-27 00:05:57","FALSE","0","0","1","Employment","Karnataka","India",FALSE
"115","[Job] Only Fresher- Civil Engineer with STAAD PRO and SACS Experience | Company: Nauvata Engineering Pvt. Ltd | Loc  ","2018-07-26 22:52:46","FALSE","0","0","1","Employment","Karnataka","India",FALSE
"116","Hardware High Speed Board Designer job at Mindteck - Bengaluru, Karnataka  ","2018-07-26 21:13:10","FALSE","0","0","0","Employment","Karnataka","India",FALSE
"117","[Job] Staff Engineer - SAAS Platforms | Company: Qubole, Inc | Location: Bengaluru KA Karnataka India | Bengaluru  ","2018-07-26 19:22:44","FALSE","0","0","0","Employment","Karnataka","India",FALSE
"118","Data Scientist job at Multi Recruit - Bengaluru, Karnataka  ","2018-07-26 19:18:36","FALSE","0","0","0","Employment","Karnataka","India",FALSE
"119","[Job] Solution Architect | Company: Atos | Location: Bengaluru KA Karnataka India | Bengaluru Telecommunications  ","2018-07-26 18:32:46","FALSE","0","0","0","Employment","Karnataka","India",FALSE
"120","[Job] Quality Assurance Engineer | Company: General Electric | Location: Bengaluru KA Karnataka India | Bengaluru  ","2018-07-26 18:32:44","FALSE","0","0","1","Employment","Karnataka","India",FALSE
"121","Can you recommend anyone for this job? Associate Manager -  ","2018-07-26 18:16:37","FALSE","0","0","1","Employment","Karnataka","India",FALSE
"122","RT @ajaykumar2697: It takes 15 hours to draw this tattoo on the back of a man in Karnataka
who believes that PM Modi had done a tremendo","2018-07-26 18:16:00","TRUE","500","0","0","Employment","Karnataka","India",FALSE
"123","RT @ajaykumar2697: It takes 15 hours to draw this tattoo on the back of a man in Karnataka
who believes that PM Modi had done a tremendo","2018-07-26 18:14:32","TRUE","500","0","0","Employment","Karnataka","India",TRUE
"124","Meet BJP's new home minister aspirant.. @narendramodi please look into his resume, fit for the job If I Were Hom  ","2018-07-26 17:38:30","FALSE","0","0","0","Employment","Karnataka","India",FALSE
"125","Android Developer job at Multi Recruit - Bengaluru, Karnataka  ","2018-07-26 17:17:18","FALSE","0","1","0","Employment","Karnataka","India",FALSE
"126","NO END TO ARRESTS OF IPS POLICE OFFICIALS OF KARNATAKA!  CORRUPT ""UPSC"" BACKS CORRUPT OFFICIALS. -  ","2018-07-26 17:05:05","FALSE","0","0","-2","Employment","Karnataka","India",FALSE
"127","[Job] Marine Integrity Engineer | Company: ExxonMobil | Location: Bengaluru KA Karnataka India | Bengaluru Marine  ","2018-07-26 16:52:46","FALSE","0","0","0","Employment","Karnataka","India",FALSE
"128","Want to work in Bengaluru, Karnataka? View our latest opening:  ","2018-07-26 16:19:54","FALSE","0","0","1","Employment","Karnataka","India",TRUE
"129","[Job] Managing Consultant - Energy - Downstream | Company: Wipro LTD | Location: Bengaluru KA Karnataka India |  ","2018-07-26 15:52:48","FALSE","0","0","0","Employment","Karnataka","India",FALSE
"130","[Job] Consultant - Energy - Downstream | Company: Wipro LTD | Location: Bengaluru KA Karnataka India | Bengaluru  ","2018-07-26 15:52:45","FALSE","0","0","0","Employment","Karnataka","India",FALSE
"131","RT @Anandagundurao: @DKShivakumar @RahulGandhi @INCKarnataka @INCIndia @IYC @NSUIKarnataka @IYCKar BJP and central leaders did such a smear","2018-07-26 15:46:58","TRUE","2","0","-1","Employment","Karnataka","India",TRUE
"132","@priyankac19 Here they died bcoz of no food. In Karnataka, u have put shame to us by not giving salary to a civic w  ","2018-07-26 15:37:46","FALSE","0","0","-2","Employment","Karnataka","India",FALSE
"133","[Job] Technical Lead - Power Electronics | Company: Schneider Electric | Location: Jigani KA Karnataka India |  ","2018-07-26 15:22:58","FALSE","0","0","1","Employment","Karnataka","India",FALSE
